"ID","SpellID","Enabled","Type","Token","Name","Description","Icon"
"1","900010","1","trash","bolster","Bolstering","When any non-boss enemy dies, its death cry empowers nearby allies, increasing their maximum health and damage by 20%.","Interface\Icons\Spell_Fire_Immolation"
"2","900020","1","trash","necrotic","Necrotic","All enemies' melee attacks apply a stacking healing reduction effect.","Interface\Icons\Spell_Frost_ChillingBlast"
"3","900030","1","trash","grievous","Grievous","Players below 90% health take periodic damage until healed above the threshold.","Interface\Icons\Spell_Nature_NatureGuardian"
"4","0","1","boss","tyrannical","Tyrannical","Boss enemies have 40% more health and inflict 15% more damage.","Interface\Icons\Ability_Warrior_BattleShout"
"5","0","1","trash","fortified","Fortified","Non-boss enemies have 20% more health and inflict 30% more damage.","Interface\Icons\Spell_Nature_Earthquake"
"6","0","1","trash","raging","Raging","Enemies deal more damage at low health.","Interface\Icons\Spell_Shadow_SoulGem"
"7","0","1","trash","sanguine","Sanguine","Enemies leave behind a sanguine zone on death.","Interface\Icons\Spell_Nature_Thorns"
"8","0","1","trash","volcanic","Volcanic","Volcanic plumes erupt under players who stay at range.","Interface\Icons\Inv_Misc_Volatilefire"